{
    "$schema": "https://json-schema.org/draft/2020-12/schema",
    "title": "EUDI Personal Identification Data (PID) Claims",
    "type": "object",
    "properties": {
        "familyName": {
            "title": "Family Name",
            "description": "The current last name(s) or surname(s) of the person.",
            "type": "string"
        },
        "givenName": {
            "title": "Given name",
            "description": "The current first and middle name(s) of the person, if applicable.",
            "type": "string"
        },
        "birthDate": {
            "title": "Date of birth",
            "description": "The person’s date of birth (day, month, and year).",
            "type": "string",
            "format": "date"
        },
        "birthPlace": {
            "title": "Place of birth",
            "description": "The person’s place of birth (country code or local area).",
            "type": "string"
        },

        "nationality":{
            "title": "Nationalities",
            "description": "ISO 3166-1 alpha-2 country codes, one per nationality",
            "type": "array",
            "minItems": 1,
            "items": {
                "type": "string",
                "pattern": "^[A-Z]{2}$"
            }
        },

        "residentAddress":{
            "title": "Resident address",
            "description": "The complete address where the person currently lives or can be reached (street, number, city, etc.).",
            "type": "string"
        },
        "residentCountry":{
            "title": "Resident country",
            "description": "ISO 3166-1 alpha-2 country code",
            "type": "string",
            "pattern": "^[A-Z]{2}$"
        },
        "residentState":{
            "title": "Resident state",
            "description": "The person’s current state, province, district, or local area.",
            "type": "string"
        },
        "residentCity":{
            "title": "Resident city",
            "description": "The person’s current municipality, city, town, or village.",
            "type": "string"
        },
        "residentPostalCode":{
            "title": "Resident postal code",
            "description": "The person’s current postal code.",
            "type": "string"
        },
        "residentStreet":{
            "title": "Resident street",
            "description": "The person’s current street name.",
            "type": "string" 
        },
        "residentHouseNumber": {
            "title": "Resident house number",
            "description": "The person’s current house number (including any suffix).",
            "type": "string" 
        },

        "familyNameBirth": {
            "title": "Family name at birth",
            "description": "The person’s birth last name(s) or surname(s).",
            "type": "string"
        },
        "givenNameBirth": {
            "title":  "Given name at birth",
            "description": "The person’s birth first and middle name(s).",
            "type": "string"
        },
        "emailAddress": {
            "title": "Email",
            "description": "The person’s email address (per RFC 5322).",
            "type": "string",
            "format": "email"
        },
        "mobilePhoneNumber": {
            "title": "Phone number",
            "description": "The person’s mobile number in international format (starting with '+' and country code).",
            "type": "string"
        },
        "portrait": {
            "title": "Portrait",
            "description": "JPEG data URL",
            "type": "string",
            "pattern": "^data:image\\/jpeg;base64,"
        },
        "personalAdministrativeNumber": {
            "title": "Personal administrative number",
            "description": "A unique personal number assigned to the person by the identification data provider, with usage policies defined by the issuing authority.",
            "type": "string"
        },
        "sex": {
            "title": "Sex",
            "description": "0 unknown, 1 male, 2 female, 9 not applicable",
            "type": "integer",
            "enum": [0, 1, 2, 9]
        }
    },
    "required": []
}