{
    "familyName": "Muller",
    "givenName": "Erika",
    "birthDate": "1985-03-15",
    "birthPlace": "Munich",
    "nationality": ["DE", "AT"],
    "residentAddress": "Hauptstraße 123, 80331 München, Germany",
    "residentCountry": "DE",
    "residentState": "Bavaria",
    "residentCity": "München",
    "residentPostalCode": "80331",
    "residentStreet": "Hauptstraße",
    "residentHouseNumber": "123",

    "familyNameBirth": "Schmidt",
    "givenNameBirth": "Erika",
    "emailAddress": "erika.muller@example.com",
    "mobilePhoneNumber": "+49-89-12345678",
    "portrait": "data:image/jpeg;base64,...",
    "personalAdministrativeNumber": "123456789012",
    "sex": 2
}